{
  "code": "wholesale_distributor",
  "sector": "retail",
  "name": "Wholesale Distributor",
  "description": "B2B wholesale distributor with customer price lists, delivery routes, warehouse management, commission tracking, and grouped invoicing",
  "icon": "cube-outline",
  "color": "#455a64",
  "is_combinable": true,
  "ufo_matrix": {
    "FIN": "na",
    "COM": "na",
    "ALM": "na",
    "TPV": "na",
    "VEN": "na",
    "CRM": "na",
    "ECO": "na",
    "PRO": "na",
    "LOG": "na",
    "RRH": "na",
    "PRY": "na",
    "BI": "na"
  },
  "extra_modules": [
    "customers",
    "inventory",
    "invoicing",
    "purchase_orders",
    "sales",
    "tax",
    "warehouse"
  ],
  "sector_features": [
    "Customer price lists",
    "Delivery routes",
    "Commission tracking",
    "Grouped invoicing",
    "B2B sales"
  ],
  "roles": [
    {
      "id": "sales_rep",
      "name": "Sales Representative",
      "permissions": [
        "customers.*",
        "quotes.*",
        "invoicing.view_*",
        "inventory.view_*"
      ]
    },
    {
      "id": "warehouse_worker",
      "name": "Warehouse Worker",
      "permissions": [
        "inventory.*",
        "warehouse.*",
        "shipping.*"
      ]
    }
  ],
  "products_file": "products/wholesale_distributor.json"
}
