{
  "code": "real_estate_agency",
  "sector": "real_estate",
  "name": "Real Estate Agency",
  "description": "Real estate agency with property listings, client matching, visit scheduling, contract management, and commission tracking",
  "icon": "home-outline",
  "color": "#1b5e20",
  "is_combinable": false,
  "ufo_matrix": {
    "FIN": "na",
    "COM": "na",
    "ALM": "na",
    "TPV": "na",
    "VEN": "na",
    "CRM": "na",
    "ECO": "na",
    "PRO": "na",
    "LOG": "na",
    "RRH": "na",
    "PRY": "na",
    "BI": "na"
  },
  "extra_modules": [
    "contracts",
    "customers",
    "invoicing",
    "leads",
    "tax"
  ],
  "sector_features": [
    "Property listings",
    "Client matching",
    "Visit scheduling",
    "Contract management",
    "Commission tracking"
  ],
  "roles": [
    {
      "id": "agent",
      "name": "Real Estate Agent",
      "permissions": [
        "leads.*",
        "customers.*",
        "contracts.view_*"
      ]
    },
    {
      "id": "manager",
      "name": "Manager",
      "permissions": [
        "leads.*",
        "customers.*",
        "contracts.*",
        "invoicing.*",
        "reports.view_*"
      ]
    }
  ],
  "products_file": "products/real_estate_agency.json"
}
