{
  "code": "catering",
  "sector": "hospitality",
  "name": "Catering",
  "description": "Catering and event services with per-event budgets, BOM recipes, production orders, temporary staff, and event tracking",
  "icon": "people-outline",
  "color": "#9c27b0",
  "is_combinable": true,
  "ufo_matrix": {
    "FIN": "essential",
    "COM": "essential",
    "ALM": "essential",
    "TPV": "recommended",
    "VEN": "essential",
    "CRM": "essential",
    "ECO": "recommended",
    "PRO": "essential",
    "LOG": "recommended",
    "RRH": "essential",
    "PRY": "essential",
    "BI": "recommended"
  },
  "extra_modules": ["projects", "tasks", "orders", "online_payments", "invoicing"],
  "sector_features": [
    "Per-event budgets",
    "BOM recipes",
    "Production orders",
    "Temporary staff",
    "Event tracking"
  ],
  "roles": [
    {
      "id": "event_coordinator",
      "name": "Event Coordinator",
      "permissions": ["projects.*", "tasks.*", "customers.*", "orders.*"]
    },
    {
      "id": "chef",
      "name": "Chef",
      "permissions": ["kitchen.*", "orders.*", "inventory.view_*"]
    },
    {
      "id": "sales_rep",
      "name": "Sales Representative",
      "permissions": ["quotes.*", "customers.*", "invoicing.view_*"]
    }
  ],
  "products_file": "products/catering.json"
}
