{
  "code": "maintenance_company",
  "sector": "construction",
  "name": "Maintenance & SAT",
  "description": "Maintenance and technical service company with SLA contracts, tickets, technician dispatch, van inventory, and work reports",
  "icon": "build-outline",
  "color": "#4e342e",
  "is_combinable": true,
  "ufo_matrix": {
    "FIN": "na",
    "COM": "na",
    "ALM": "na",
    "TPV": "na",
    "VEN": "na",
    "CRM": "na",
    "ECO": "na",
    "PRO": "na",
    "LOG": "na",
    "RRH": "na",
    "PRY": "na",
    "BI": "na"
  },
  "extra_modules": [
    "contracts",
    "customers",
    "invoicing",
    "maintenance",
    "staff",
    "tasks",
    "tax"
  ],
  "sector_features": [
    "SLA contracts",
    "Ticket / incident management",
    "Technician dispatch",
    "Van inventory",
    "Work reports"
  ],
  "roles": [
    {
      "id": "technician",
      "name": "Technician",
      "permissions": [
        "maintenance.*",
        "field_service.*",
        "tasks.*",
        "inventory.view_*"
      ]
    },
    {
      "id": "dispatcher",
      "name": "Dispatcher",
      "permissions": [
        "maintenance.*",
        "tasks.*",
        "schedules.*",
        "customers.*"
      ]
    }
  ],
  "products_file": "products/maintenance_company.json"
}
