{
  "code": "vet_clinic",
  "sector": "personal_services",
  "name": "Veterinary Clinic",
  "description": "Veterinary clinic with patient records, appointment scheduling, medication inventory, clinical history, and integrated billing",
  "icon": "paw-outline",
  "color": "#2e7d32",
  "is_combinable": true,
  "ufo_matrix": {
    "FIN": "na",
    "COM": "na",
    "ALM": "na",
    "TPV": "na",
    "VEN": "na",
    "CRM": "na",
    "ECO": "na",
    "PRO": "na",
    "LOG": "na",
    "RRH": "na",
    "PRY": "na",
    "BI": "na"
  },
  "extra_modules": [
    "appointments",
    "cash_register",
    "customers",
    "inventory",
    "invoicing",
    "patient_records",
    "sales",
    "tax"
  ],
  "sector_features": [
    "Patient records",
    "Clinical history",
    "Vaccination tracking",
    "Medication inventory",
    "Appointment scheduling"
  ],
  "roles": [
    {
      "id": "veterinarian",
      "name": "Veterinarian",
      "permissions": [
        "patient_records.*",
        "appointments.*",
        "services.*",
        "customers.*",
        "inventory.view_*",
        "sales.*"
      ]
    },
    {
      "id": "vet_assistant",
      "name": "Veterinary Assistant",
      "permissions": [
        "patient_records.view_*",
        "appointments.*",
        "customers.view_*",
        "inventory.view_*",
        "sales.*"
      ]
    },
    {
      "id": "receptionist",
      "name": "Receptionist",
      "permissions": [
        "appointments.*",
        "customers.*",
        "sales.*",
        "cash_register.*"
      ]
    }
  ],
  "products_file": "products/vet_clinic.json"
}
