{
  "code": "marketing_agency",
  "sector": "professional_services",
  "name": "Marketing Agency",
  "description": "Marketing or advertising agency with creative project management, briefings, timesheet, freelancer management, and client reporting",
  "icon": "megaphone-outline",
  "color": "#ff6b35",
  "is_combinable": true,
  "ufo_matrix": {
    "FIN": "na",
    "COM": "na",
    "ALM": "na",
    "TPV": "na",
    "VEN": "na",
    "CRM": "na",
    "ECO": "na",
    "PRO": "na",
    "LOG": "na",
    "RRH": "na",
    "PRY": "na",
    "BI": "na"
  },
  "extra_modules": [
    "customers",
    "invoicing",
    "projects",
    "tasks",
    "tax",
    "time_control"
  ],
  "sector_features": [
    "Creative project management",
    "Briefings",
    "Timesheet",
    "Freelancer management",
    "Client reporting"
  ],
  "roles": [
    {
      "id": "account_manager",
      "name": "Account Manager",
      "permissions": [
        "projects.*",
        "customers.*",
        "tasks.*",
        "campaigns.view_*"
      ]
    },
    {
      "id": "creative",
      "name": "Creative",
      "permissions": [
        "projects.view_*",
        "tasks.*",
        "time_control.*"
      ]
    }
  ],
  "products_file": "products/marketing_agency.json"
}
