{
  "code": "hotel",
  "sector": "hotels_tourism",
  "name": "Hotel",
  "description": "Full-service hotel with room management, reservations, check-in/check-out, housekeeping, restaurant, and billing",
  "icon": "bed-outline",
  "color": "#1a237e",
  "is_combinable": false,
  "ufo_matrix": {
    "FIN": "essential",
    "COM": "essential",
    "ALM": "essential",
    "TPV": "essential",
    "VEN": "essential",
    "CRM": "essential",
    "ECO": "essential",
    "PRO": "na",
    "LOG": "na",
    "RRH": "essential",
    "PRY": "recommended",
    "BI": "essential"
  },
  "extra_modules": ["reservations", "customers", "invoicing", "online_booking", "online_payments", "sales", "cash_register"],
  "sector_features": [
    "Room management",
    "Check-in / check-out",
    "Housekeeping",
    "Channel manager integration",
    "Restaurant POS integration"
  ],
  "roles": [
    {
      "id": "receptionist",
      "name": "Receptionist",
      "permissions": ["reservations.*", "customers.*", "sales.*", "cash_register.*"]
    },
    {
      "id": "housekeeper",
      "name": "Housekeeper",
      "permissions": ["reservations.view_*", "tasks.*"]
    },
    {
      "id": "manager",
      "name": "Manager",
      "permissions": ["reservations.*", "customers.*", "sales.*", "reports.view_*", "staff.view_*"]
    }
  ],
  "products_file": "products/hotel.json"
}
