{
  "code": "beauty_center",
  "sector": "personal_services",
  "name": "Beauty Center",
  "description": "Beauty center with cabin scheduling, session packages, consent forms",
  "icon": "heart-outline",
  "color": "#ad1457",
  "is_combinable": true,
  "ufo_matrix": {
    "FIN": "essential",
    "COM": "essential",
    "ALM": "essential",
    "TPV": "essential",
    "VEN": "na",
    "CRM": "essential",
    "ECO": "recommended",
    "PRO": "na",
    "LOG": "na",
    "RRH": "essential",
    "PRY": "na",
    "BI": "recommended"
  },
  "extra_modules": [],
  "sector_features": [
    "Cabin scheduling",
    "Session packages",
    "Consent forms"
  ],
  "roles": [
    {
      "id": "manager",
      "name": "Manager",
      "permissions": [
        "*"
      ]
    }
  ],
  "products_file": "products/beauty_center.json"
}
