{
  "code": "carpentry",
  "sector": "manufacturing",
  "name": "Carpentry / Workshop",
  "description": "Carpentry or woodworking workshop with custom quotes, BOM/cutting lists, production orders, finishing tracking, and delivery",
  "icon": "hammer-outline",
  "color": "#4e342e",
  "is_combinable": true,
  "ufo_matrix": {
    "FIN": "na",
    "COM": "na",
    "ALM": "na",
    "TPV": "na",
    "VEN": "na",
    "CRM": "na",
    "ECO": "na",
    "PRO": "na",
    "LOG": "na",
    "RRH": "na",
    "PRY": "na",
    "BI": "na"
  },
  "extra_modules": [
    "customers",
    "inventory",
    "invoicing",
    "manufacturing",
    "purchase_orders",
    "quotes",
    "tax"
  ],
  "sector_features": [
    "Custom quotes",
    "BOM / cutting lists",
    "Production orders",
    "Finishing tracking",
    "Delivery coordination"
  ],
  "roles": [
    {
      "id": "master_craftsman",
      "name": "Master Craftsman",
      "permissions": [
        "manufacturing.*",
        "projects.*",
        "inventory.*"
      ]
    },
    {
      "id": "sales_rep",
      "name": "Sales Representative",
      "permissions": [
        "quotes.*",
        "customers.*",
        "invoicing.view_*"
      ]
    }
  ],
  "products_file": "products/carpentry.json"
}
