{
  "code": "logistics_company",
  "sector": "logistics",
  "name": "Logistics & Distribution",
  "description": "Logistics and distribution company with shipment tracking, route optimization, fleet management, warehouse operations, and client billing",
  "icon": "material:local_shipping",
  "color": "#37474f",
  "is_combinable": false,
  "ufo_matrix": {
    "FIN": "na",
    "COM": "na",
    "ALM": "na",
    "TPV": "na",
    "VEN": "na",
    "CRM": "na",
    "ECO": "na",
    "PRO": "na",
    "LOG": "na",
    "RRH": "na",
    "PRY": "na",
    "BI": "na"
  },
  "extra_modules": [
    "customers",
    "fleet",
    "inventory",
    "invoicing",
    "shipping",
    "tax",
    "warehouse"
  ],
  "sector_features": [
    "Shipment tracking",
    "Route optimization",
    "Fleet management",
    "Warehouse operations",
    "Client billing"
  ],
  "roles": [
    {
      "id": "dispatcher",
      "name": "Dispatcher",
      "permissions": [
        "shipping.*",
        "fleet.view_*",
        "tasks.*"
      ]
    },
    {
      "id": "delivery_driver",
      "name": "Delivery Driver",
      "permissions": [
        "shipping.view_*",
        "tasks.*"
      ]
    },
    {
      "id": "warehouse_worker",
      "name": "Warehouse Worker",
      "permissions": [
        "warehouse.*",
        "inventory.*"
      ]
    }
  ],
  "products_file": "products/logistics_company.json"
}