{
  "code": "assembly",
  "sector": "manufacturing",
  "name": "Assembly Line",
  "description": "Assembly line operation with multi-level BOM, work orders, serial number tracking, quality inspections, and production scheduling",
  "icon": "layers-outline",
  "color": "#455a64",
  "is_combinable": false,
  "ufo_matrix": {
    "FIN": "na",
    "COM": "na",
    "ALM": "na",
    "TPV": "na",
    "VEN": "na",
    "CRM": "na",
    "ECO": "na",
    "PRO": "na",
    "LOG": "na",
    "RRH": "na",
    "PRY": "na",
    "BI": "na"
  },
  "extra_modules": [
    "inventory",
    "invoicing",
    "manufacturing",
    "purchase_orders",
    "quality",
    "tax",
    "warehouse"
  ],
  "sector_features": [
    "Multi-level BOM",
    "Work orders",
    "Serial number tracking",
    "Quality inspections",
    "Production scheduling"
  ],
  "roles": [
    {
      "id": "production_manager",
      "name": "Production Manager",
      "permissions": [
        "manufacturing.*",
        "quality.*",
        "inventory.*"
      ]
    },
    {
      "id": "warehouse_worker",
      "name": "Warehouse Worker",
      "permissions": [
        "inventory.*",
        "warehouse.*"
      ]
    }
  ],
  "products_file": "products/assembly.json"
}
