{
  "code": "bar",
  "sector": "hospitality",
  "name": "Bar",
  "description": "Bar with drinks service, tapas, cocktails, and table management for pubs, taverns, and nightlife venues",
  "icon": "beer-outline",
  "color": "#ff6b35",
  "is_combinable": true,
  "ufo_matrix": {
    "FIN": "na",
    "COM": "na",
    "ALM": "na",
    "TPV": "na",
    "VEN": "na",
    "CRM": "na",
    "ECO": "na",
    "PRO": "na",
    "LOG": "na",
    "RRH": "na",
    "PRY": "na",
    "BI": "na"
  },
  "extra_modules": [
    "cash_register",
    "customers",
    "inventory",
    "invoicing",
    "orders",
    "sales",
    "tables",
    "tax"
  ],
  "sector_features": [
    "Drink service",
    "Tapas and snacks",
    "Cocktail menu",
    "Table zones"
  ],
  "roles": [
    {
      "id": "bartender",
      "name": "Bartender",
      "permissions": [
        "sales.*",
        "cash_register.*",
        "tables.*",
        "inventory.view_*"
      ]
    },
    {
      "id": "waiter",
      "name": "Waiter",
      "permissions": [
        "sales.*",
        "tables.*",
        "orders.*"
      ]
    }
  ],
  "products_file": "products/bar.json"
}
