{
  "code": "online_courses",
  "sector": "education",
  "name": "Online Courses",
  "description": "Online learning platform with course creation, student management, subscriptions, certifications, and live sessions",
  "icon": "desktop-outline",
  "color": "#4a148c",
  "is_combinable": true,
  "ufo_matrix": {
    "FIN": "na",
    "COM": "na",
    "ALM": "na",
    "TPV": "na",
    "VEN": "na",
    "CRM": "na",
    "ECO": "na",
    "PRO": "na",
    "LOG": "na",
    "RRH": "na",
    "PRY": "na",
    "BI": "na"
  },
  "extra_modules": [
    "course_mgmt",
    "invoicing",
    "student_mgmt",
    "subscriptions",
    "tax"
  ],
  "sector_features": [
    "Course creation",
    "Student management",
    "Subscription plans",
    "Certifications",
    "Live sessions"
  ],
  "roles": [
    {
      "id": "instructor",
      "name": "Instructor",
      "permissions": [
        "course_mgmt.*",
        "student_mgmt.view_*"
      ]
    },
    {
      "id": "admin",
      "name": "Admin",
      "permissions": [
        "student_mgmt.*",
        "course_mgmt.*",
        "invoicing.*",
        "analytics.view_*"
      ]
    }
  ],
  "products_file": "products/online_courses.json"
}
