{
  "code": "accounting_firm",
  "sector": "professional_services",
  "name": "Accounting Firm",
  "description": "Accounting or tax advisory firm with fiscal calendar, multi-client management, client portal, and regulatory compliance",
  "icon": "calculator-outline",
  "color": "#1b5e20",
  "is_combinable": true,
  "ufo_matrix": {
    "FIN": "na",
    "COM": "na",
    "ALM": "na",
    "TPV": "na",
    "VEN": "na",
    "CRM": "na",
    "ECO": "na",
    "PRO": "na",
    "LOG": "na",
    "RRH": "na",
    "PRY": "na",
    "BI": "na"
  },
  "extra_modules": [
    "contracts",
    "customers",
    "invoicing",
    "projects",
    "tasks",
    "tax",
    "time_control"
  ],
  "sector_features": [
    "Fiscal calendar",
    "Multi-client management",
    "Client portal",
    "Document management",
    "Regulatory compliance"
  ],
  "roles": [
    {
      "id": "accountant",
      "name": "Accountant",
      "permissions": [
        "projects.*",
        "tasks.*",
        "time_control.*",
        "customers.view_*",
        "doc_templates.*"
      ]
    },
    {
      "id": "manager",
      "name": "Manager",
      "permissions": [
        "projects.*",
        "customers.*",
        "invoicing.*",
        "contracts.*",
        "reports.view_*"
      ]
    }
  ],
  "products_file": "products/accounting_firm.json"
}
