{
  "code": "installer",
  "sector": "construction",
  "name": "Installer (Plumbing, Electric, HVAC)",
  "description": "Installer company for plumbing, electrical, or HVAC with work orders, mobile stock, maintenance contracts, and field invoicing",
  "icon": "flash-outline",
  "color": "#f57f17",
  "is_combinable": true,
  "ufo_matrix": {
    "FIN": "na",
    "COM": "na",
    "ALM": "na",
    "TPV": "na",
    "VEN": "na",
    "CRM": "na",
    "ECO": "na",
    "PRO": "na",
    "LOG": "na",
    "RRH": "na",
    "PRY": "na",
    "BI": "na"
  },
  "extra_modules": [
    "customers",
    "inventory",
    "invoicing",
    "quotes",
    "staff",
    "tasks",
    "tax"
  ],
  "sector_features": [
    "Work orders",
    "Mobile stock",
    "Maintenance contracts",
    "Field invoicing",
    "Customer portal"
  ],
  "roles": [
    {
      "id": "installer",
      "name": "Installer",
      "permissions": [
        "tasks.*",
        "field_service.*",
        "inventory.view_*"
      ]
    },
    {
      "id": "manager",
      "name": "Manager",
      "permissions": [
        "quotes.*",
        "customers.*",
        "invoicing.*",
        "staff.view_*"
      ]
    }
  ],
  "products_file": "products/installer.json"
}
