{
  "code": "manufacturing",
  "sector": "manufacturing",
  "name": "Manufacturing / Factory",
  "description": "Manufacturing or factory with bills of materials, work orders, MRP, quality control, and cost tracking",
  "icon": "cog-outline",
  "color": "#37474f",
  "is_combinable": false,
  "ufo_matrix": {
    "FIN": "na",
    "COM": "na",
    "ALM": "na",
    "TPV": "na",
    "VEN": "na",
    "CRM": "na",
    "ECO": "na",
    "PRO": "na",
    "LOG": "na",
    "RRH": "na",
    "PRY": "na",
    "BI": "na"
  },
  "extra_modules": [
    "customers",
    "inventory",
    "invoicing",
    "manufacturing",
    "purchase_orders",
    "quality",
    "tax",
    "warehouse"
  ],
  "sector_features": [
    "Bills of materials (BOM)",
    "Work orders",
    "MRP planning",
    "Quality control",
    "Cost tracking"
  ],
  "roles": [
    {
      "id": "production_manager",
      "name": "Production Manager",
      "permissions": [
        "manufacturing.*",
        "quality.*",
        "inventory.*",
        "purchase_orders.view_*"
      ]
    },
    {
      "id": "warehouse_worker",
      "name": "Warehouse Worker",
      "permissions": [
        "inventory.*",
        "warehouse.*"
      ]
    },
    {
      "id": "sales_rep",
      "name": "Sales Representative",
      "permissions": [
        "quotes.*",
        "customers.*",
        "invoicing.*"
      ]
    }
  ],
  "products_file": "products/manufacturing.json"
}
