{
  "code": "car_rental",
  "sector": "automotive",
  "name": "Car Rental",
  "description": "Car rental company with fleet management, reservation system, damage tracking, insurance management, and online booking",
  "icon": "key-outline",
  "color": "#e65100",
  "is_combinable": false,
  "ufo_matrix": {
    "FIN": "na",
    "COM": "na",
    "ALM": "na",
    "TPV": "na",
    "VEN": "na",
    "CRM": "na",
    "ECO": "na",
    "PRO": "na",
    "LOG": "na",
    "RRH": "na",
    "PRY": "na",
    "BI": "na"
  },
  "extra_modules": [
    "contracts",
    "customers",
    "fleet",
    "invoicing",
    "reservations",
    "tax"
  ],
  "sector_features": [
    "Fleet management",
    "Reservation system",
    "Damage tracking",
    "Insurance management",
    "Online booking"
  ],
  "roles": [
    {
      "id": "agent",
      "name": "Rental Agent",
      "permissions": [
        "reservations.*",
        "customers.*",
        "sales.*",
        "cash_register.*",
        "fleet.view_*"
      ]
    },
    {
      "id": "fleet_manager",
      "name": "Fleet Manager",
      "permissions": [
        "fleet.*",
        "maintenance.*"
      ]
    }
  ],
  "products_file": "products/car_rental.json"
}
