{
  "code": "warehouse",
  "sector": "logistics",
  "name": "Warehousing & Storage",
  "description": "Warehousing and storage facility with location management, stock control, inbound/outbound operations, and client billing",
  "icon": "cube-outline",
  "color": "#546e7a",
  "is_combinable": false,
  "ufo_matrix": {
    "FIN": "essential",
    "COM": "essential",
    "ALM": "essential",
    "TPV": "na",
    "VEN": "essential",
    "CRM": "essential",
    "ECO": "na",
    "PRO": "na",
    "LOG": "essential",
    "RRH": "essential",
    "PRY": "na",
    "BI": "essential"
  },
  "extra_modules": ["warehouse", "inventory", "purchase_orders", "invoicing", "customers"],
  "sector_features": [
    "Location management",
    "Stock control",
    "Inbound / outbound operations",
    "Client billing",
    "Traceability"
  ],
  "roles": [
    {
      "id": "warehouse_manager",
      "name": "Warehouse Manager",
      "permissions": ["warehouse.*", "inventory.*", "purchase_orders.*"]
    },
    {
      "id": "warehouse_worker",
      "name": "Warehouse Worker",
      "permissions": ["warehouse.*", "inventory.view_*"]
    }
  ],
  "products_file": "products/warehouse.json"
}
